idrss_entries,title,public_date,category,provider,number_of_articles
"38666","Theoretical Limit Of Solar Cell Efficiency Probably Broken","Mon Mar 25 04:07:41 EDT 2013","Science","CleanTechnica","3"
"38679","3 re-beached whales euthanized","Mon Mar 25 04:53:52 EDT 2013","Science","News24","24"
"38690","Another Sinkhole Opens in Seffner","Sun Mar 24 05:18:57 EDT 2013","Science","Patch.com","25"
"38712","Rare Giraffe Born: Rare and Endangered Rothschild Giraffe at Connecticut ...","Sun Mar 24 22:16:37 EDT 2013","Science","Science World Report","16"
"38715","Pilot whales beach in South Africa","Sun Mar 24 07:08:00 EDT 2013","Science","The Associated Press","24"
"38716","Video: Rare Rothschild giraffe born at LEO Conservation Center","Mon Mar 25 05:44:22 EDT 2013","Science","DigitalJournal.com","18"
"38729","Robots descend upon Tabernacle school during engineering competition","Sun Mar 24 19:29:04 EDT 2013","Science","phillyBurbs.com","18"
"38735","Yet another sinkhole eats up real estate in Seffner, Florida","Mon Mar 25 05:56:29 EDT 2013","Science","msnNOW","26"
"38759","Rare giraffe born in Connecticut","Mon Mar 25 05:34:18 EDT 2013","Science","Toronto Sun","18"
"38769","Endangered Rothschild Giraffe Born in Connecticut Zoo [Video]","Mon Mar 25 06:25:30 EDT 2013","Science","Nature World News","19"
"38787","NASA's Mars Spacecraft Go Solo Next Month","Mon Mar 25 05:46:08 EDT 2013","Science","Yahoo! News (blog)","9"
"38828","OUR OPINION: Universe is older than we thought","Mon Mar 25 07:12:50 EDT 2013","Science","San Angelo Standard Times","7"
"38852","Researchers suggest comet most likely cause of Chicxulub crater","Mon Mar 25 07:27:53 EDT 2013","Science","Phys.Org","32"
"38853","DNA Discoverer's Descriptive Letter to Son to be auctioned for more than a Million","Mon Mar 25 07:29:12 EDT 2013","Science","French Tribune","22"
"38854","Solar Cell Efficiency can be Increased Using Nanowires","Mon Mar 25 07:29:11 EDT 2013","Science","French Tribune","4"
"38913","Nanowires Break Limit of Solar Cell Efficiency: The Future of Sustainable Energy","Mon Mar 25 07:58:08 EDT 2013","Science","Science World Report","5"
"38955","Another sinkhole opens in Seffner, Florida, the town where Jeff Bush was killed","Mon Mar 25 08:29:47 EDT 2013","Science","Macleans.ca (blog)","27"
"38976","Nanowires increase limit of solar cell efficiency, say researchers","Mon Mar 25 08:40:57 EDT 2013","Science","Science Recorder","6"
"38977","Baby giraffe is only a few days old and already as tall as you are","Mon Mar 25 08:45:06 EDT 2013","Science","msnNOW","21"
"38978","New Florida sinkhole in same Florida town","Mon Mar 25 08:41:04 EDT 2013","Science","Christian Science Monitor","28"
"39006","Delaware meteor lights up sky","Sat Mar 23 10:59:40 EDT 2013","Science","Washington Post","6"
"39042","Mars Curiosity rover gets back to sending snapshots","Sat Mar 23 18:17:13 EDT 2013","Science","NBCNews.com (blog)","10"
"39061","Solar Conjunction Puts NASA Mars Exploration on Pause","Mon Mar 25 09:15:46 EDT 2013","Science","Mobile Magazine","11"
"39085","Europe's Planck space telescope challenges understanding of universe for ...","Mon Mar 25 09:22:53 EDT 2013","Science","Mancunian Matters","9"
"39086","Rare, Endangered Giraffe Born At Greenwich Conservation Center","Mon Mar 25 09:28:09 EDT 2013","Science","CBS Local","22"
"39135","The Conservation Perspective on 'De-extinction'","Mon Mar 25 09:17:05 EDT 2013","Science","Huffington Post","9"
"39142","They may be dime-sized, but this mosquito is no big deal - The News","Mon Mar 25 01:11:40 EDT 2013","Science","Press","4"
"39155","Giant Mosquitoes Invade Florida: Entomologist Reveals Reality Of Gallinipper ...","Mon Mar 25 09:52:26 EDT 2013","Science","Huffington Post","4"
"39173","Rare Giraffe Born At Conn. Conservation Center (Video)","Mon Mar 25 10:03:51 EDT 2013","Science","Vibe","26"
"39174","Mars Conjunction Signals Communications Blackout Between Earth and Mars ...","Mon Mar 25 10:10:02 EDT 2013","Science","Nature World News","12"
"39230","Solar Flares 2013: Solar Storms, Eruptions And CMEs, Outlook For The Year ...","Mon Mar 25 06:31:15 EDT 2013","Science","PlanetSave.com","11"
"39265","Rare, endangered giraffe gives birth in Connecticut","Mon Mar 25 10:51:18 EDT 2013","Science","UPI.com (blog)","26"
"39278","De-Extinction Could Bring Back 24 Different Species: Resurrecting the Woolly ...","Mon Mar 25 11:06:21 EDT 2013","Science","Science World Report","11"
"39279","Global landmarks go dark for Earth Hour","Sun Mar 24 21:26:44 EDT 2013","Science","USA TODAY","8"
"39312","Another Sinkhole Opens in Town Where Florida Man was Swallowed in His Sleep","Mon Mar 25 09:12:42 EDT 2013","Science","Science World Report","34"
"39313","Chaotic vortex on Venus' south pole unpredictable","Mon Mar 25 11:15:46 EDT 2013","Science","Examiner.com","-1"
"39317","New Images Reveal Ever-Present Venus Vortex More Chaotic and Unpredictable","Mon Mar 25 10:09:53 EDT 2013","Science","Science World Report","5"
"39318","Rare Giraffe Born at Connecticut Zoo [VIDEO]","Mon Mar 25 11:18:11 EDT 2013","Science","WebProNews","28"
"39346","First time standing","Mon Mar 25 11:24:27 EDT 2013","Science","Christian Science Monitor","29"
"39371","Space Memorabilia Is Up For Auction","Mon Mar 25 11:37:31 EDT 2013","Science","Nature World News","9"
"39407","Solar cells 'hairy' with nanowires could push back efficiency limits","Mon Mar 25 11:54:28 EDT 2013","Science","Treehugger (blog)","8"
"39425","Nanowires can Increase Efficiency of Solar Cells: Researchers","Mon Mar 25 11:55:55 EDT 2013","Science","Nature World News","9"
"39448","Graphene Sponges: The Lightest Material on the Planet","Mon Mar 25 11:48:33 EDT 2013","Science","Gizmodo","8"
"39450","Graphene Sponges: The New Lightest Material on the Planet","Mon Mar 25 11:48:33 EDT 2013","Science","Gizmodo","8"
"39463","Sinkhole opens up in Florida town — again — three kilometres away from where ...","Mon Mar 25 12:15:25 EDT 2013","Science","National Post","37"
"39477","New Sinkhole Opens In Seffner, Florida, Where Man Was Swallowed In Bed ...","Mon Mar 25 12:22:38 EDT 2013","Science","Huffington Post","39"
"39510","Ephemeral vacuum particles induce speed-of-light fluctuations","Mon Mar 25 11:37:29 EDT 2013","Science","Science Codex","2"
"39539","Giant Killer Mosquitoes Set to Invade Bradenton","Mon Mar 25 12:41:46 EDT 2013","Science","Patch.com","4"
"39547","Mars Spacecraft Communications To Be Disrupted By Solar Conjunction In April","Mon Mar 25 09:02:51 EDT 2013","Science","Huffington Post","13"
"39580","World Landmarks Go Dark For 'Earth Hour'","Sat Mar 23 21:55:48 EDT 2013","Science","WFMY News 2","8"
"39581","Ephemeral Vacuum Particles Cause Fluctuations in the Speed of Light: New ...","Mon Mar 25 12:58:52 EDT 2013","Science","Science World Report","3"
"39652","Laser empties atoms from the inside out","Mon Mar 25 11:38:05 EDT 2013","Science","Eureka! Science News","-1"
"39669","Scientists preserve embryos from critically endangered Iberian lynx","Mon Mar 25 13:28:26 EDT 2013","Science","GlobalPost","6"
"39678","Nanowires could boost solar power 15X","Mon Mar 25 13:29:13 EDT 2013","Science","Computerworld","10"
"39704","New Research Shows the Speed of Light is Variable in Real Space","Mon Mar 25 13:36:03 EDT 2013","Science","Cleveland Leader","4"
"39743","UNL to host lectures on climate change and drought","Mon Mar 25 12:03:29 EDT 2013","Science","Lincoln Journal Star","5"
"39744","Lightest Material on Earth Could Mop up Oil Spills: Uses for the Graphene Sponge","Mon Mar 25 13:53:57 EDT 2013","Science","Science World Report","9"
"39745","Giant skeeter hysteria builds, but is it humbug?","Mon Mar 25 13:20:19 EDT 2013","Science","Tbo.com","5"
"39757","Antimatter's Magnetic Charge Revealed","Mon Mar 25 14:09:23 EDT 2013","Science","Yahoo! News (blog)","4"
"39769","Viewpoint: Antiprotons Reflect a Magnetic Symmetry","Mon Mar 25 10:59:28 EDT 2013","Science","Physics","4"
"39781","Embryos of world's most endangered cat preserved for 1st time","Mon Mar 25 10:08:50 EDT 2013","Science","Fox News","7"
"39782","Brace yourself for the invasion of the giant mosquitoes","Mon Mar 25 14:10:43 EDT 2013","Science","Orlando Sentinel","6"
"39857","Liberty Co.: Wedding lanterns led to calls of 'fireballs in the sky'","Mon Mar 25 14:27:23 EDT 2013","Science","abc13.com","7"
"39858","So it turns out the speed of light might not be constant after all","Mon Mar 25 14:35:49 EDT 2013","Science","Catholic Online","5"
"39866","'Fire ball' UFO sighting reported outside Houston","Mon Mar 25 06:25:11 EDT 2013","Science","KSAT San Antonio","7"
"39902","Nanowires boost photovoltaics sunlight capture by 15X","Mon Mar 25 15:04:16 EDT 2013","Science","Register","11"
"39940","Most Endangered Wild Cat on Earth Saved by Castration: Embryos Preserved ...","Mon Mar 25 15:14:53 EDT 2013","Science","Science World Report","8"
"39941","UFOs explained as Chinese lanterns launched by wedding party","Mon Mar 25 15:17:00 EDT 2013","Science","Your Houston News","9"
"39947","Ever-Changing Venus Superstorm Sparks Interest","Mon Mar 25 13:47:19 EDT 2013","Science","Space.com","8"
"39951","The Solar System's Most Spectacular Polar Superstorms","Mon Mar 25 15:36:10 EDT 2013","Science","Wired","8"
"39966","Where Life Could Thrive: Interview With John Grotzinger","Mon Mar 25 14:57:56 EDT 2013","Science","Space Daily","15"
"39976","New Studies Suggest the Speed of Light is Variable","Mon Mar 25 15:37:48 EDT 2013","Science","Nature World News","6"
"40000","Endangered “Demon Primate” Genome Sequenced","Mon Mar 25 15:08:36 EDT 2013","Science","National Geographic","4"
"40016","New Sinkhole Opens in Seffner, Florida 'Sinkhole Season' in Full Swing","Mon Mar 25 15:58:49 EDT 2013","Science","The Jacksonville Observer","44"
"40044","NASA Prepares For Solar Conjunction Blocking Mars to Earth Communications","Mon Mar 25 16:05:31 EDT 2013","Science","Science World Report","16"
"40075","Mar Curiosity Rover is sending back photos again","Mon Mar 25 16:23:53 EDT 2013","Science","imaging resource","17"
"40076","Scientists Castrate One of the World's Most Endangered Species","Mon Mar 25 16:27:43 EDT 2013","Science","Nature World News","9"
"40105","Third sinkhole in three weeks for Seffner","Mon Mar 25 16:39:00 EDT 2013","Science","WTSP 10 News","48"
"40106","Mars Curiosity Rover is sending back photos again","Mon Mar 25 16:28:34 EDT 2013","Science","imaging resource","17"
"40107","2-Headed Shark Fetus Netted by Fisherman","Mon Mar 25 13:38:17 EDT 2013","Science","LiveScience.com","9"
"40124","De-extinction: Oh God, yes -- or worst idea ever?","Mon Mar 25 16:46:00 EDT 2013","Science","HLNtv.com","13"
"40184","Red Crabs Swarm Island: Christmas Island Crab Migration Dubbed One Of The ...","Mon Mar 25 17:22:50 EDT 2013","Science","Huffington Post","9"
"40185","Mars rover back in action after computer problems","Mon Mar 25 17:16:00 EDT 2013","Science","The Associated Press","18"
"40186","Florida fisherman bags two-headed MUTANT SHARK","Mon Mar 25 17:20:42 EDT 2013","Science","Register","10"
"40198","Was duck penis study an appropriate use of taxpayer money?","Mon Mar 25 16:57:46 EDT 2013","Science","Fox News","7"
"40229","Yes, We Should Study Duck Penises","Mon Mar 25 12:29:04 EDT 2013","Science","Daily Beast","-1"
"40244","Genome study to aid Madagascar lemurs","Mon Mar 25 17:51:17 EDT 2013","Science","UPI.com","6"
"40276","Scientists Find Universe is 80 Million Years Older","Mon Mar 25 18:05:17 EDT 2013","Science","EDGEOnTheNet","14"
"40277","Scientists Announce Sequencing of the Aye-Aye Lemur's Genome","Mon Mar 25 18:11:26 EDT 2013","Science","Nature World News","7"
"40332","Into the maelstrom: US coastal population grows as storms intensify","Mon Mar 25 18:23:54 EDT 2013","Science","NBCNews.com (blog)","4"
"40350","Mars rover back in action after computer glitches","Mon Mar 25 18:39:52 EDT 2013","Science","WPMI Local 15 News","22"
"40351","Scientists examine nothing, find something","Mon Mar 25 18:37:37 EDT 2013","Science","Christian Science Monitor","7"
"40352","APNewsBreak: No Pups Born to Isle Royale Wolves","Mon Mar 25 18:38:18 EDT 2013","Science","ABC News","4"
"40382","Curiosity Resumes Science Investigations","Mon Mar 25 18:52:59 EDT 2013","Science","Jet Propulsion Laboratory","22"
"40475","NASA's Mars rover resumes work after computer glitch","Mon Mar 25 19:52:15 EDT 2013","Science","Chicago Tribune","27"
"40501","Speed Of Light Might Not Be The Constant We Thought It Was","Mon Mar 25 20:05:55 EDT 2013","Science","Latinos Post","8"
"40545","Researchers measure the magnetic charge of antimatter","Mon Mar 25 20:14:06 EDT 2013","Science","SlashGear","6"
"40571","Mars rover back to full science operations","Mon Mar 25 20:42:45 EDT 2013","Science","UPI.com","26"
"40572","What Happened to All the Birds in the Most Recently Colonized Regions of Earth?","Mon Mar 25 19:22:01 EDT 2013","Science","io9","10"
"40607","Curiosity out of safe mode, doing science again","Mon Mar 25 21:04:12 EDT 2013","Science","Register","27"
"40663","New Map Of Universe Shows What Earthly Physics Can't","Mon Mar 25 21:58:12 EDT 2013","Science","Space Daily","15"
"40696","Did conservationists really castrate one of the world's most endangered species?","Mon Mar 25 22:23:14 EDT 2013","Science","Science Recorder","10"
"40697","Scientists Sequence DNA Of Endangered Madagascar Lemur","Mon Mar 25 22:25:31 EDT 2013","Science","Latinos Post","10"
"40737","Wedding lanterns mistaken for UFOs in Liberty County","Mon Mar 25 22:47:46 EDT 2013","Science","MyFox Houston","11"
"40773","Scientists Sequence Genome of Threatened Lemur","Mon Mar 25 23:14:55 EDT 2013","Science","Counsel & Heal","11"
"40774","Iberian Lynx, World's Rarest Cat, Is Castrated To Keep Population Growing","Mon Mar 25 23:17:03 EDT 2013","Science","Latinos Post","11"
"40793","Humans to Blame for Pacific Bird Extinction, Representing 10 Percent of Worlds ...","Mon Mar 25 23:39:34 EDT 2013","Science","Nature World News","12"
"40833","Nanowire Solar Cells Kevin Bullis","Tue Mar 26 00:10:36 EDT 2013","Science","MIT Technology Review (blog)","14"
"40967","Light travels at many Speeds,new studies suggest","Tue Mar 26 03:07:39 EDT 2013","Science","Science Recorder","10"
"40968","James Cameron's sub given to science","Tue Mar 26 04:04:02 EDT 2013","Science","BBC News","9"
"40969","Freezing and storing endangered lynx embryos keeps hope for the species alive","Tue Mar 26 03:07:45 EDT 2013","Science","Science Recorder","12"
"40970","Humans Are The Cause Of A Mass Bird Extinction In The Pacific Islands, Study ...","Tue Mar 26 06:53:14 EDT 2013","Science","Latinos Post","16"
"40971","Two spacecraft being built at a cost of £225million... so they can be CRASHED ...","Tue Mar 26 07:00:43 EDT 2013","Science","Daily Mail","10"
"40987","SpaceX Dragon cargo ship leaves space station","Tue Mar 26 07:18:00 EDT 2013","Science","The Associated Press","40"
"40988","Who Has the Right to Mine an Asteroid?","Tue Mar 26 07:10:17 EDT 2013","Science","Popular Mechanics","13"
"40994","Speed of Light is Not Constant, Say Scientists","Tue Mar 26 07:20:02 EDT 2013","Science","French Tribune","11"
"41022","Tiny Lemur Twins Are 2 New Species","Tue Mar 26 07:25:30 EDT 2013","Science","LiveScience.com","16"
"41062","DNA Analysis Helps Researchers Identify New Mouse Lemur Species","Tue Mar 26 07:52:02 EDT 2013","Science","Nature World News","17"
"41063","SpaceX Dragon cargo capsule leaves space station, heads for splashdown","Tue Mar 26 07:32:47 EDT 2013","Science","NBCNews.com","45"
"41079","Double-headed shark fetus netted by fisherman","Tue Mar 26 07:55:30 EDT 2013","Science","Fox News","22"
"41087","SpaceX Dragon cargo ship leaves space station, aims for Pacific splashdown ...","Tue Mar 26 08:13:42 EDT 2013","Science","Washington Post","49"
"41118","Space station capsule to return Monday to Earth","Thu Mar 21 16:26:32 EDT 2013","Science","USA TODAY","-1"
"41134","In Asteroid's Aftermath, a Sigh of Relief","Mon Mar 25 14:36:31 EDT 2013","Science","New York Times","7"
"41155","James Cameron donates Deapsea Challenger submarine to science","Tue Mar 26 08:32:47 EDT 2013","Science","The Guardian","13"
"41177","Humans Wipe Out Pacific Island Birds in Mass Extinction Event, Killing Hundreds ...","Tue Mar 26 08:43:44 EDT 2013","Science","Science World Report","20"
"41178","Fisherman nets two-headed mutant shark","Tue Mar 26 08:23:08 EDT 2013","Science","Science Recorder","24"
"41204","Population along US Coast to Hit 134 Million by 2020: NOAA Report","Tue Mar 26 08:47:04 EDT 2013","Science","Nature World News","6"
"41211","Bacteria power 'bio-battery' breakthrough","Mon Mar 25 16:42:29 EDT 2013","Science","BBC News","7"
"41243","Two-Headed Bull Shark Found in Gulf of Mexico, Scientists Say","Tue Mar 26 09:08:13 EDT 2013","Science","NBC 6 South Florida","27"
"41267","Two, New, Teacup-sized Species of Mouse Lemur Lookalikes Discovered in ...","Tue Mar 26 09:19:26 EDT 2013","Science","Science World Report","7"
"41276","Fisherman finds a bull shark with two heads","Tue Mar 26 09:21:30 EDT 2013","Science","io9","29"
"41309","Asteroid deflection mission AIDA set for impact in 2022","Tue Mar 26 09:41:31 EDT 2013","Science","DigitalJournal.com","16"
"41322","First Two-Headed Bull Shark Confirmed By Science As Actually Two-Headed","Tue Mar 26 09:44:17 EDT 2013","Science","Geekosystem","30"
"41327","James Cameron donates Deepsea Challenger submarine to science","Tue Mar 26 10:02:55 EDT 2013","Science","The Guardian","14"
"41332","MIT shows off huge solar cell efficiency boost by throwing nanowires into the mix","Tue Mar 26 09:50:07 EDT 2013","Science","ExtremeTech","15"
"41333","Researchers discover two headed shark in the Gulf of Mexico","Tue Mar 26 09:52:19 EDT 2013","Science","SlashGear","32"
"41345","Marine Bacteria Power 'Bio-Battery' Breakthrough: Future of Clean Electricity","Tue Mar 26 10:06:28 EDT 2013","Science","Science World Report","9"
"41376","scientists see moderate spring, summer red tide for Gulf of Maine","Mon Mar 25 21:11:15 EDT 2013","Science","NOAA","3"
"41394","Red Tide Coming to New England","Tue Mar 26 10:24:34 EDT 2013","Science","Discovery News","3"
"41414","Icedandic police use lowest level of civil warning after earthquake swarm near ...","Tue Mar 26 10:31:49 EDT 2013","Science","Fox News","5"
"41426","The Scharnhorst Effect claims we've got the speed of light wrong","Tue Mar 26 10:29:01 EDT 2013","Science","io9","14"
"41435","Texas officials to announce $91M vaccine center","Tue Mar 26 09:24:58 EDT 2013","Science","FOX 29","-1"
"41436","Decoding the genetic history of the Texas longhorn","Mon Mar 25 17:19:46 EDT 2013","Science","Eureka! Science News","4"
"41446","School Academy Helps Students Accomplish Goals","Tue Mar 26 10:25:27 EDT 2013","Science","FOX 29","4"
"41456","Two New Species of Tea-Cup Sized Mouse Lemurs Discovered in Madagascar","Tue Mar 26 10:53:51 EDT 2013","Science","Cleveland Leader","8"
"41485","Two-Headed Shark Found by Fisherman","Tue Mar 26 11:12:18 EDT 2013","Science","National Geographic","37"
"41504","Nesting Sea Turtles Face Challenges","Tue Mar 26 10:18:38 EDT 2013","Science","WBFS","10"
"41510","Endangered, Creepy-Looking Aye-Aye's Genome Sequenced for First Time","Tue Mar 26 11:21:08 EDT 2013","Science","Science World Report","13"
"41511","Madagascar Mouse Lemur Lookalikes Discovered, DNA Analysis Identifies 2 ...","Tue Mar 26 11:16:54 EDT 2013","Science","Z6Mag","9"
"41587","Speed of Light May Not be Constant","Tue Mar 26 11:49:32 EDT 2013","Science","Voice of America (blog)","15"
"41608","Why the GOP Should Love Duck Penises","Tue Mar 26 11:38:32 EDT 2013","Science","Mother Jones","9"
"41633","Planck snaps infant Universe","Tue Mar 26 12:17:03 EDT 2013","Science","Nature.com","18"
"41665","Alert Status Raised at Iceland's Hekla","Tue Mar 26 11:50:49 EDT 2013","Science","Wired (blog)","11"
"41666","Arctic Sea Ice Reaches Maximum Extent","Tue Mar 26 12:22:13 EDT 2013","Science","eNews Park Forest","12"
"41673","SpaceX Dragon headed home from space station","Tue Mar 26 11:24:20 EDT 2013","Science","Computerworld","75"
"41701","Space station capsule splashes down in Pacific","Tue Mar 26 12:46:49 EDT 2013","Science","USA TODAY","75"
"41702","James Cameron To Donate Submarine to Science","Tue Mar 26 12:39:26 EDT 2013","Science","Discovery News","19"
"41721","Space station capsule splashes down in Pacific Ocean","Tue Mar 26 12:46:49 EDT 2013","Science","USA TODAY","75"
"41732","Hundreds of bird species driven to extinction by human colonisation in Pacific","Tue Mar 26 12:42:25 EDT 2013","Science","Radio New Zealand International","20"
"41795","Researchers create ultra-thin and flexible Harry Potter-like invisibility cloak","Tue Mar 26 13:20:05 EDT 2013","Science","ExtremeTech","7"
"41823","SpaceX Dragon capsule splashes down with ton of space station cargo","Tue Mar 26 13:42:30 EDT 2013","Science","NBCNews.com","83"
"41841","SpaceX splashdown: Capsule returns 2668 pounds of science samples","Tue Mar 26 13:42:15 EDT 2013","Science","Los Angeles Times","89"
"41854","Found: Africa's Oldest Penguins","Tue Mar 26 11:58:31 EDT 2013","Science","LiveScience.com","5"
"41866","Fossils show penguin diversity in Africa millions of years ago","Tue Mar 26 13:26:27 EDT 2013","Science","Toronto Sun","5"
"41894","Water Quality in Half of U.S. Rivers Is 'Poor,' EPA Says","Tue Mar 26 13:33:46 EDT 2013","Science","Bloomberg","6"
"41902","SpaceX Dragon cargo ship splashes into Pacific","Tue Mar 26 14:21:59 EDT 2013","Science","Fox News","90"
"41961","Will nanowires provide a breakthrough for solar power efficiency?","Tue Mar 26 14:45:11 EDT 2013","Science","Christian Science Monitor","17"
"41962","Astronomers Discover New Type of Supernova","Tue Mar 26 14:44:06 EDT 2013","Science","Cleveland Leader","4"
"41963","Two new rare lemur species join primate club","Tue Mar 26 03:10:00 EDT 2013","Science","AFP","9"
"41964","Rare two-headed bull shark fetus found in Gulf of Mexico","Tue Mar 26 14:43:17 EDT 2013","Science","New York Daily News","45"
"41966","SEE IT: Rare two-headed bull shark fetus found by fisherman in Gulf of Mexico","Tue Mar 26 14:43:17 EDT 2013","Science","New York Daily News","45"
"42029","Two-Headed Shark Identified By MSU Scientists","Wed Mar 27 20:49:31 EDT 2013","Science","CBS Local","81"
"42030","Madagascar Seen by UN Needing $22 Million to Fight Locust Plague","Tue Mar 26 08:55:47 EDT 2013","Science","Businessweek","13"
"42031","James Cameron Donates Sub to Oceanographic Institution","Wed Mar 27 17:47:29 EDT 2013","Science","ABC News","43"
"42032","Pint-sized Supernova Revealed","Wed Mar 27 18:02:49 EDT 2013","Science","National Geographic","23"
"42033","Neonicotinoid pesticides 'damage brains of bees'","Wed Mar 27 12:08:16 EDT 2013","Science","BBC News","13"
"42034","NASA: Saturn's moons and rings are 'vintage' goods","Wed Mar 27 20:26:39 EDT 2013","Science","The Space Reporter","5"
"42035","Mysterious Perfectly Formed Pond Circles Appear in NY, Work of UFO's? [PHOTO]","Wed Mar 27 18:29:47 EDT 2013","Science","Counsel & Heal","15"
"42036","New super-thin, flexible invisibility cloak wows Harry Potter fans","Wed Mar 27 18:26:43 EDT 2013","Science","Los Angeles Times","44"
"42037","Mars quiz: How well do you know the Red Planet?","Wed Mar 27 20:29:15 EDT 2013","Science","Los Angeles Times","12"
"42038","Human colonization of the Pacific left piles of dead birds in its wake","Wed Mar 27 20:03:24 EDT 2013","Science","Ars Technica","29"
"42147","Half the length of US streams and rivers in poor condition","Tue Mar 26 17:46:44 EDT 2013","Science","Los Angeles Times","49"
"42196","Energy gleaned from thin air may come in the future","Wed Mar 27 21:13:28 EDT 2013","Science","The Albany Herald","19"
"42241","Pesticides may be cause of worldwide bee die-off","Thu Mar 28 00:02:13 EDT 2013","Science","Science Recorder","14"
"42306","Madagascar hit by plague of locusts","Thu Mar 28 01:04:07 EDT 2013","Science","Myjoyonline.com","13"
"42352","This Is The Obama Administration's Proposal To Help Wildlife Deal With ...","Wed Mar 27 17:32:05 EDT 2013","Science","Popular Science","11"
"42401","Appeals court says EPA's decisions on Texas' clean-air plan were justified","Wed Mar 27 23:55:08 EDT 2013","Science","Dallas Morning News","51"
"42402","Dundee researchers find pesticide mix stops bees learning","Wed Mar 27 12:25:07 EDT 2013","Science","BBC News","14"
"42416","NASA reports Comet could possibly Collide with Mars in 2014","Thu Mar 28 02:32:59 EDT 2013","Science","Clarksville Online","13"
"42479","Why a Mars Comet Impact Would be Awesome","Thu Mar 28 03:01:17 EDT 2013","Science","Discovery News","14"
"42573","pesticides 'damage brains of bees'","Thu Mar 28 04:45:21 EDT 2013","Science","BBC News","16"
"42614","Saturn Rings have been Around for about 4 Billion Years: NASA","Thu Mar 28 05:02:57 EDT 2013","Science","Nature World News","5"
"42662","Sea hares' sticky defence uncovered","Thu Mar 28 05:39:44 EDT 2013","Science","BBC News","5"
"42719","Plague of locusts hits Madagascar","Thu Mar 28 06:20:56 EDT 2013","Science","BBC News","15"
"42720","'Harry Potter'-like invisibility cloak made by scientists","Thu Mar 28 06:21:56 EDT 2013","Science","Digital Spy","93"
"42743","Plague of locusts in Madagascar","Thu Mar 28 06:49:00 EDT 2013","Science","BBC News","15"
"42772","Did Aliens Create Pond Circles in NY?","Tue Mar 26 13:59:38 EDT 2013","Science","LiveScience.com","16"
"42815","Hoffman: Angry Birds could take over the entertainment world - The Star-Ledger","Thu Mar 28 07:27:24 EDT 2013","Science","NJ.com","10"
"42856","Saturn's moons, rings date back to birth of solar system","Thu Mar 28 07:55:56 EDT 2013","Science","The Hindu","6"
"42867","Federal Appeals Court Ruling on Lawsuit Against EPA is a Partial Loss For ...","Thu Mar 28 08:06:56 EDT 2013","Science","Dallas Observer (blog)","52"
"42868","Two-Headed Bull Shark Confirmed Rarest in the World","Thu Mar 28 08:05:17 EDT 2013","Science","TIME","86"
