idrss_entries,title,public_date,category,provider,number_of_articles
"88","Two-thirds of forest elephants killed by ivory poachers in past decade","Tue Mar 05 06:23:30 EST 2013","Science","The Guardian","40"
"89","Comet set to make closest approach ever to Earth","Tue Mar 05 23:13:41 EST 2013","Science","Science Recorder","60"
"90","Ships to sail directly over the north pole by 2050, scientists say","Mon Mar 04 15:00:52 EST 2013","Science","The Guardian","45"
"91","Skulls of alligator kin shed new light on reptiles' murky history","Mon Mar 04 18:46:34 EST 2013","Science","Los Angeles Times","14"
"92","Canada's North, Home to Bears, and Once, Camels","Tue Mar 05 22:18:12 EST 2013","Science","New York Times","45"
"93","Grotesque Mummy Head Reveals Advanced Medieval Science","Tue Mar 05 09:36:37 EST 2013","Science","LiveScience.com","2"
"94","Europa's Oceans Might Taste Like Earth's Oceans","Tue Mar 05 15:20:34 EST 2013","Science","Wired (blog)","5"
"95","Sinister 'Space Invaders' galaxy found; can we trust our eyes?","Tue Mar 05 18:56:53 EST 2013","Science","Los Angeles Times","20"
"96","Curiosity Rover Leaves Safe Mode, Comes Back Online","Tue Mar 05 23:20:56 EST 2013","Science","Geekosystem","90"
"97","Why it's good for SpaceX's private spaceships to rise above the glitches","Wed Mar 06 00:05:00 EST 2013","Science","NBCNews.com (blog)","74"
"143","Space Invaders Photo Bomb Hubble Telescope Pictures","Tue Mar 05 22:06:19 EST 2013","Science","RedOrbit","20"
"154","A Window into Europa's Ocean Right at the Surface","Tue Mar 05 13:52:12 EST 2013","Science","Jet Propulsion Laboratory","5"
"235","Two-thirds of forest elephants killed by ivory poachers in past decade","Tue Mar 05 06:23:30 EST 2013","Science","The Guardian","40"
"236","Comet set to make closest approach ever to Earth","Tue Mar 05 23:13:41 EST 2013","Science","Science Recorder","61"
"237","Ships to sail directly over the north pole by 2050, scientists say","Mon Mar 04 15:00:52 EST 2013","Science","The Guardian","45"
"238","A Window into Europa's Ocean Right at the Surface","Tue Mar 05 13:52:12 EST 2013","Science","Jet Propulsion Laboratory","7"
"239","Skulls of alligator kin shed new light on reptiles' murky history","Mon Mar 04 18:46:34 EST 2013","Science","Los Angeles Times","14"
"240","Canada's North, Home to Bears, and Once, Camels","Tue Mar 05 22:18:12 EST 2013","Science","New York Times","44"
"241","Space Invaders Photo Bomb Hubble Telescope Pictures","Tue Mar 05 22:06:19 EST 2013","Science","RedOrbit","20"
"242","Grotesque Mummy Head Reveals Advanced Medieval Science","Tue Mar 05 09:36:37 EST 2013","Science","LiveScience.com","2"
"243","Curiosity Rover Leaves Safe Mode, Comes Back Online","Tue Mar 05 23:20:56 EST 2013","Science","Geekosystem","90"
"244","Why it's good for SpaceX's private spaceships to rise above the glitches","Wed Mar 06 00:05:00 EST 2013","Science","NBCNews.com (blog)","74"
"266","Hubble Spies a Space Invader","Tue Mar 05 11:46:37 EST 2013","Science","Slate Magazine (blog)","20"
"267","Europa's sea similar to salty ocean on Earth","Wed Mar 06 01:21:57 EST 2013","Science","Zee News","7"
"287","Engineers troubleshoot Curiosity computer glitch","Fri Mar 01 00:17:45 EST 2013","Science","CNET","91"
"296","Beck Tops At Science Fair","Tue Mar 05 23:52:51 EST 2013","Science","Archbold Buckeye","18"
"301","Study: Massive camels once roamed the Canadian Arctic","Wed Mar 06 01:39:25 EST 2013","Science","Science Recorder","45"
"318","NASA and ESA Think This Distorted Galaxy Looks Like a Space Invader","Tue Mar 05 23:20:50 EST 2013","Science","Geekosystem","20"
"333","Tourists to Get Airplane View of Bright Comet Pan-STARRS","Tue Mar 05 18:52:06 EST 2013","Science","Space.com","61"
"363","Comet making closest approach ever of Earth","Wed Mar 06 00:59:33 EST 2013","Science","Hindu Business Line","62"
"376","Surveys Quantify Loss of Elephants in Africa","Tue Mar 05 16:43:59 EST 2013","Science","New York Times","40"
"390","Nasa's Curiosity rover to be back online next week","Wed Mar 06 02:40:36 EST 2013","Science","Times LIVE","92"
"391","Hindenburg Cause Solved","Tue Mar 05 20:07:10 EST 2013","Science","Patch.com","34"
"407","Hubble Telescope's 'Space Invader' Galaxy Photos (Gallery)","Tue Mar 05 11:19:09 EST 2013","Science","Space.com","20"
"408","Ancient Arctic camel a curious conundrum","Tue Mar 05 16:24:39 EST 2013","Science","Fox News","45"
"409","Scientists: Europa -- Jupiter's moon -- may have a sea similar to Earth's","Wed Mar 06 02:45:14 EST 2013","Science","Science Recorder","7"
"459","Supply ship meets space station after shaky start","Wed Mar 06 03:13:13 EST 2013","Science","Watertown Public Opinion","75"
"494","NASA's Curiosity rover to be back online next week","Wed Mar 06 03:32:01 EST 2013","Science","Economic Times","93"
"495","Wow! Rare Photos Capture 2 Comets Together in Night Sky","Tue Mar 05 16:44:06 EST 2013","Science","Space.com","62"
"502","African Forest Elephant Population Endangered, Poaching And Ivory Trade To ...","Tue Mar 05 22:56:20 EST 2013","Science","Latinos Post","34"
"512","Elephant Poaching Pushes Species To Brink Of Extinction","Wed Mar 06 03:44:21 EST 2013","Science","NPR","35"
"557","World's most detailed scans will reveal how brain works","Tue Mar 05 13:30:00 EST 2013","Science","BBC News","8"
"603","Global warming is about to remake worldwide shipping","Wed Mar 06 05:01:11 EST 2013","Science","Fortune","47"
"604","Comet streaks past Earth in closest-ever approach","Wed Mar 06 05:01:02 EST 2013","Science","Indian Express","63"
"617","Space Invader alien 'spotted' in a galaxy far, far away by Hubble Telescope","Wed Mar 06 05:03:45 EST 2013","Science","Mirror.co.uk","21"
"626","Hindenburg mystery solved 76 years after historic catastrophe: static electricity ...","Sun Mar 03 19:23:14 EST 2013","Science","Daily Mail","36"
"627","Subsurface Water on Europa Tastes like Earth's Oceanic Water","Wed Mar 06 05:13:34 EST 2013","Science","French Tribune","8"
"666","NASA's Curiosity Rover to be back online next week","Wed Mar 06 05:43:23 EST 2013","Science","Hindu Business Line","93"
"733","Stop ivory poaching or face sanctions, nations warned at Cites","Wed Mar 06 06:13:29 EST 2013","Science","The Guardian","38"
"765","Two comets dot night sky","Wed Mar 06 06:36:41 EST 2013","Science","The Advocate","65"
"786","On Jupiter's Moon Europa, Underground Ocean Bubbles Up to Surface","Wed Mar 06 06:47:13 EST 2013","Science","Space.com","9"
"812","Private SpaceX Capsule Brings Big Science to Space Station","Wed Mar 06 06:55:16 EST 2013","Science","Space.com","76"
"824","Comet to become visible to RI watchers soon","Wed Mar 06 07:07:06 EST 2013","Science","The Providence Journal","66"
"832","Asteroid 2013 ET zooms past Earth this weekend","Wed Mar 06 01:45:53 EST 2013","Science","DigitalJournal.com","46"
"842","Big Asteroid to Zoom By Earth This Weekend","Tue Mar 05 22:51:41 EST 2013","Science","Space.com","64"
"850","Curiosity Back to Active Status: NASA","Wed Mar 06 07:17:00 EST 2013","Science","Science World Report","94"
"852","Ancient crocs swam to North America","Tue Mar 05 05:59:44 EST 2013","Science","TG Daily","16"
"873","Falkland Islands: Scientists Claim They Solved Darwin's Wolf Mystery","Wed Mar 06 05:25:06 EST 2013","Science","Latinos Post","28"
"901","Falklanders Vote 170 Years After Argentina Offer","Tue Mar 05 19:17:50 EST 2013","Science","Bloomberg","28"
"908","Wildlife experts: Ivory trade threatens elephants","Wed Mar 06 07:56:38 EST 2013","Science","Huffington Post","43"
"943","View Comet Pan-STARRS March 6-12—With Luck","Wed Mar 06 08:08:48 EST 2013","Science","Patch.com","66"
"969","Polar bear trade ban 'too close to call'","Wed Mar 06 08:20:01 EST 2013","Science","BBC News","7"
"995","Raw: Mt. Etna Eruption Lights Up Sky in Italy","Wed Mar 06 08:09:39 EST 2013","Science","USA TODAY","11"
"1004","The origin of the Falkland Island wolf: A Darwin mystery solved","Wed Mar 06 08:36:29 EST 2013","Science","Los Angeles Times","29"
"1011","Camel Fossils Found In Arctic Suggest Ancient Creatures Roamed Region 3.5 ...","Wed Mar 06 08:37:35 EST 2013","Science","Huffington Post","55"
"1060","Astronomers Find Evidence of Ocean Salts on Europa's Surface.","Wed Mar 06 08:05:05 EST 2013","Science","Slate Magazine (blog)","12"
"1159","Asteroid the Size of a Football Field to Buzz by Earth This Weekend","Wed Mar 06 09:45:31 EST 2013","Science","Cleveland Leader","66"
"1181","Oceans on Jupiter's Europa Resemble Oceans Found on Earth","Wed Mar 06 08:15:11 EST 2013","Science","Nature World News","12"
"1182","Online ivory trade threatens Africa's elephants","Tue Mar 05 12:27:54 EST 2013","Science","Fox News","50"
"1191","Check out these pictures of Mount Etna - Europe's largest volcano - erupting!","Wed Mar 06 07:23:31 EST 2013","Science","BBC News","14"
"1243","Wildlife Experts: Ivory Trade Threatens...","Wed Mar 06 10:24:44 EST 2013","Science","ABC News","53"
"1303","Top conservation groups warn of sanctions against nations involved in ivory trade","Wed Mar 06 10:36:59 EST 2013","Science","Fox News","53"
"1310","Melting Arctic Ice Will Make Way for More Ships and More Species Invasions","Wed Mar 06 10:41:57 EST 2013","Science","Scientific American","47"
"1312","Bright Comet Set for Dazzling Sky Show this Month","Mon Mar 04 15:42:21 EST 2013","Science","Space.com","69"
"1318","900-Pound Camels Used to Live in the Arctic","Wed Mar 06 10:36:19 EST 2013","Science","Smithsonian (blog)","56"
"1331","Having Waited, Threatened Species Have a Chance for Protection","Wed Mar 06 10:43:18 EST 2013","Science","New York Times","9"
"1337","Ivory Trade Nations Face Threat of Sanctions","Wed Mar 06 11:00:57 EST 2013","Science","ABC News","53"
"1403","Comet Pan-STARRS holds promise for stargazers","Wed Mar 06 11:10:00 EST 2013","Science","AFP","70"
"1412","CITES Report Shows Ivory Trade Is Hastening Decline Of Endangered ...","Wed Mar 06 10:31:20 EST 2013","Science","Huffington Post","52"
"1413","Polar Bear Trade Ban Could Save Species, But Ruin Economy","Wed Mar 06 09:14:16 EST 2013","Science","Science World Report","10"
"1438","Don't call him 'Adam': South Carolina man's genes help date first man","Wed Mar 06 11:28:40 EST 2013","Science","Fox News","5"
"1472","Could Earth Germs Colonize Mars?","Wed Mar 06 11:38:22 EST 2013","Science","Discovery News","94"
"1473","How to see Comet Pan-STARRS","Wed Mar 06 11:35:39 EST 2013","Science","Space.com","70"
"1474","How Argentines feel about the Falkland Islands dispute","Wed Mar 06 11:35:59 EST 2013","Science","BBC News","34"
"1510","The Mystery of the Hindenburg Disaster Finally Solved?","Wed Mar 06 11:49:08 EST 2013","Science","TIME","36"
"1608","Raw video: Mt. Etna's spectacular eruption","Wed Mar 06 12:22:58 EST 2013","Science","Houston Chronicle","16"
"1616","Coming Soon: Long-Delayed Decisions on Endangered Species","Wed Mar 06 10:09:35 EST 2013","Science","New York Times","10"
"1650","Higgs boson closer than ever","Wed Mar 06 11:53:22 EST 2013","Science","The Hindu","5"
"1664","Elephants under threat as trade in illegal ivory triples over past decade, UN ...","Wed Mar 06 12:41:26 EST 2013","Science","UN News Centre","116"
"1665","Conservationists Propose Polar Bear Trade Ban, Opponents Cite Global ...","Wed Mar 06 12:44:18 EST 2013","Science","Latinos Post","8"
"1694","Melting Arctic ice to open new shipping lanes","Wed Mar 06 12:55:24 EST 2013","Science","kgw.com (blog)","47"
"1730","Europa's Epsom Salt May Indicate Ocean Biosphere","Wed Mar 06 12:01:08 EST 2013","Science","Discovery News","16"
"1734","A Common Thread: Religion, Elephants & Killing the Ivory Trade","Wed Mar 06 13:10:39 EST 2013","Science","Houston Chronicle (blog)","57"
"1753","Under Its Frozen Exterior, Scientists Say Europa's Ocean Is Salty Like Ours - KUHF","Wed Mar 06 13:11:54 EST 2013","Science","FM","17"
"1754","More Etna Eruption Fireworks","Wed Mar 06 13:18:59 EST 2013","Science","Wired (blog)","19"
"1784","Monster Comet may have Mars in its Crosshairs","Wed Mar 06 12:24:07 EST 2013","Science","National Geographic","37"
"1809","View Comet Pan-STARRS March 6 to 12—With Luck","Wed Mar 06 13:41:18 EST 2013","Science","Patch.com","76"
"1923","Protecting the Solar System... From Us","Wed Mar 06 14:23:08 EST 2013","Science","PBS","97"
"1925","Isolated Canada insists on being a polar bear bad guy: Walkom","Wed Mar 06 14:26:11 EST 2013","Science","Toronto Star","11"
"1949","Is it THE Higgs boson? Can't say yet","Wed Mar 06 14:32:10 EST 2013","Science","NBCNews.com (blog)","9"
"1973","Mount Etna Spews Lava and Hot Gas During Tuesday Night Eruption (VIDEO)","Wed Mar 06 14:00:23 EST 2013","Science","Latinos Post","23"
"1979","Mount Etna Erupts In Italy: Most Active Volcano In Europe Puts Local Sicilian ...","Wed Mar 06 14:44:05 EST 2013","Science","KpopStarz","23"
"2005","Curiosity sleeps as solar blast races toward Mars","Wed Mar 06 14:56:00 EST 2013","Science","The Associated Press","97"
"2026","Brightest comet in recent years visible to the naked eye","Wed Mar 06 14:04:36 EST 2013","Science","WXYZ (blog)","77"
"2052","Girls are lefties, boys are righties","Wed Mar 06 11:36:45 EST 2013","Science","Fox News","4"
"2053","View Comet Pan-STARRS Tonight Through March 12","Wed Mar 06 15:10:01 EST 2013","Science","Patch.com","77"
"2112","This Just in: Higgs Boson Still Boring","Wed Mar 06 15:05:35 EST 2013","Science","Wired (blog)","11"
"2172","Comet may be visible ... if sky clears","Wed Mar 06 15:58:13 EST 2013","Science","Newsbf.com","82"
"2179","WATCH: Mt. Etna's spectacular nighttime eruption","Wed Mar 06 16:03:47 EST 2013","Science","UPI.com (blog)","26"
"2197","Distance to neighbouring galaxy measured","Wed Mar 06 14:01:14 EST 2013","Science","Telegraph.co.uk","9"
"2226","Mount Etna Eruption Lights Up Night Sky, Italian Volcano Gives Locals A Show ...","Wed Mar 06 16:12:58 EST 2013","Science","Auto World News","28"
"2227","The Countries Fueling the Ivory Trade Must Stop Poaching or Face Sanctions","Wed Mar 06 16:14:07 EST 2013","Science","Motherboard (blog)","58"
"2229","Curiosity Rover in Downtime after Sun Blasts Radiation Stream Towards Mars","Wed Mar 06 16:03:48 EST 2013","Science","Nature World News","100"
"2243","Giant ancient camel remains discovered in Canadian Arctic","Tue Mar 05 12:11:15 EST 2013","Science","National Post","60"
"2254","China's solar king Shi 'shocked' at dismissal","Wed Mar 06 16:20:36 EST 2013","Science","Sydney Morning Herald","28"
"2278","Modern Camels Can Be Traced To Giant Creatures That Once Roamed Canada","Wed Mar 06 16:36:57 EST 2013","Science","NPR","61"
"2312","Dr. Shi Fights Back After Removal as Suntech Chairman","Wed Mar 06 16:23:36 EST 2013","Science","Greentech Media","28"
"2334","Mount Etna Eruption Caught on Video, Amazing Footage of Shooting Lava ...","Wed Mar 06 16:59:55 EST 2013","Science","Nature World News","29"
"2362","Helium-burning binary stars give us a new tape measure for the Universe.","Wed Mar 06 17:20:54 EST 2013","Science","Ars Technica","10"
"2373","Old dog bones teach scientists new trick","Wed Mar 06 17:06:33 EST 2013","Science","Los Angeles Times","5"
"2408","Fossils Suggest Giant Descendants Of Modern Camels Roamed The Canadian ...","Wed Mar 06 17:30:44 EST 2013","Science","NPR (blog)","62"
"2426","There Used To Be Freaking Camels In The Arctic","Wed Mar 06 17:37:41 EST 2013","Science","Popular Science","63"
"2463","Massive solar flare heads towards Mars; NASA prepares rover for wild ride","Wed Mar 06 17:56:39 EST 2013","Science","The Space Reporter","103"
"2479","Physicists on Higgs Hunt: Nearly There but Not Yet","Wed Mar 06 17:02:39 EST 2013","Science","ABC News","12"
"2487","Kentuckians Expected To See Bright Comet March 12th, 13th","Wed Mar 06 18:07:59 EST 2013","Science","LEX18 Lexington KY News","89"
"2505","Fossils Suggest Giant Relatives Of Modern Camels Roamed The Canadian Arctic","Wed Mar 06 18:12:09 EST 2013","Science","NPR (blog)","63"
"2506","Data reveal that the Higgs boson still looks like a Higgs boson","Wed Mar 06 18:11:34 EST 2013","Science","Los Angeles Times","14"
"2518","See Mount Etna's incredible volcanic fireworks","Wed Mar 06 18:16:38 EST 2013","Science","msnNOW","30"
"2519","Giant Camels Once Roamed Ancient Arctic","Wed Mar 06 18:08:45 EST 2013","Science","Escapist Magazine","64"
"2530","Global warming could route ships through the North Pole","Wed Mar 06 18:24:10 EST 2013","Science","Medill Reports: Chicago","51"
"2537","Alas, 'Space Invader' Galaxy is Merely a Mirage","Wed Mar 06 18:10:38 EST 2013","Science","PC Magazine","25"
"2557","Chinese Solar Approach Faces Test","Wed Mar 06 18:36:19 EST 2013","Science","Wall Street Journal","29"
"2609","US and Russia unite in bid to strengthen protection for polar bear","Tue Mar 05 11:08:12 EST 2013","Science","The Guardian","12"
"2652","International conference debates fate of endangered species","Wed Mar 06 19:19:22 EST 2013","Science","National Post","13"
"2658","Look Up! From March 5-24, Stargazers Can See Comet Pan-STARRS","Wed Mar 06 19:25:26 EST 2013","Science","Patch.com","90"
"2695","Beyond NASA: Meet the folks who are planning trips to the moon and Mars","Wed Mar 06 19:47:47 EST 2013","Science","NBCNews.com (blog)","47"
"2745","NASA prepares Curiosity rover for huge solar flare","Wed Mar 06 20:09:47 EST 2013","Science","SlashGear","104"
"2777","Vote to ban trade in polar bear parts tomorrow","Wed Mar 06 20:31:38 EST 2013","Science","Washington Times","14"
"2815","Death in the Forests","Wed Mar 06 20:53:55 EST 2013","Science","New York Times","61"
"2827","Giant Camels Were Once Found In The Arctic","Wed Mar 06 20:57:43 EST 2013","Science","Cinema Blend","65"
"2828","'God particle': Confirmation is 'achingly close'","Wed Mar 06 20:55:10 EST 2013","Science","MyFox Phoenix","17"
"2837","NASA Puts Mars Rover Curiosity on Standby After Solar Flare","Wed Mar 06 21:01:04 EST 2013","Science","Space.com","105"
"2838","Comet holds promise for stargazers","Wed Mar 06 20:19:38 EST 2013","Science","Sydney Morning Herald","91"
"2845","Giant Camels Roamed the Icy Canadian Arctic 3.5 Million Years Ago","Wed Mar 06 21:04:08 EST 2013","Science","Counsel & Heal","66"
"2857","Curiosity sleeps as solar eruption barrels toward Mars; other missions operating ...","Wed Mar 06 21:23:22 EST 2013","Science","Washington Post","105"
"2885","What's in Europa's ocean? Scientists say just scratch the surface","Wed Mar 06 21:31:46 EST 2013","Science","Los Angeles Times","20"
"2908","Our Galactic Neighbor 40000 Light-Years Closer To Milky Way Than Previously ...","Wed Mar 06 21:08:49 EST 2013","Science","Latinos Post","14"
"2909","International Delegates To Decide On Polar Bear Protections","Wed Mar 06 21:51:04 EST 2013","Science","Alaska Public Radio Network","16"
"3054","Photo of the Day: Plasma eruption on the sun captured by NASA camera","Wed Mar 06 23:28:46 EST 2013","Science","Dallas Morning News (blog)","108"
"3055","Wanted: Marriage made for Mars - Wilkes Barre Times","Wed Mar 06 23:25:56 EST 2013","Science","Leader","48"
"3090","A visitor from deep space","Wed Mar 06 23:52:07 EST 2013","Science","Methow Valley News","92"
"3094","No meteors are about to hit Earth, but Mars on the other hand…","Thu Mar 07 00:04:01 EST 2013","Science","Digital Trends","49"
"3114","Helium-burning binary stars give us a new tape measure for the Universe","Wed Mar 06 17:20:54 EST 2013","Science","Ars Technica","14"
"3118","Ancient Arctic camels could provide insight into effects of global warming","Thu Mar 07 00:12:07 EST 2013","Science","Science Recorder","68"
"3189","Curiosity in Path of Massive Solar Ejection; What is a Solar Flare and How ...","Thu Mar 07 01:10:34 EST 2013","Science","Latinos Post","111"
"3217","Bid to halt polar bear trade fails","Thu Mar 07 01:18:34 EST 2013","Science","The Guardian","23"
"3231","'Near-mythical' Viking navigational aid found in shipwreck","Wed Mar 06 16:29:14 EST 2013","Science","DigitalJournal.com","14"
"3292","Astronomers pin down distance to Milky Way's neighbour galaxy","Thu Mar 07 02:48:30 EST 2013","Science","Indian Express","15"
"3298","Astronomers gain new tape measure for the universe","Thu Mar 07 02:55:37 EST 2013","Science","TG Daily","16"
"3304","Sky Spy: This comet won't be coming back","Thu Mar 07 03:04:42 EST 2013","Science","Arizona Daily Star","95"
"3339","Incoming comet will probably miss Mars, says NASA","Tue Mar 05 17:29:38 EST 2013","Science","Register","48"
"3363","Conservation body rejects polar bear trade ban","Thu Mar 07 03:50:00 EST 2013","Science","The Associated Press","23"
"3431","Shy Higgs boson continues to vex particle hunters","Wed Mar 06 10:19:07 EST 2013","Science","New Scientist","20"
"3440","Proposal to Ban Trade in Polar Bear Parts Is Rejected","Thu Mar 07 04:52:27 EST 2013","Science","New York Times","29"
"3480","'God particle' looking 'more and more' like Higgs: scientists","Thu Mar 07 05:01:59 EST 2013","Science","Indian Express","21"
"3487","This suggests that there could be life on Jupiter's moon","Thu Mar 07 05:34:15 EST 2013","Science","Daily Mail","21"
"3494","Fossil DNA Analysis Reveal 33000 Years Old Dog Ancestor in Siberia","Wed Mar 06 22:37:54 EST 2013","Science","Nature World News","12"
"3509","Particle looking 'more and more' like Higgs: Scientists","Thu Mar 07 05:46:48 EST 2013","Science","Hindu Business Line","22"
"3533","Higgs boson expert to visit Altnagelvin cancer unit","Thu Mar 07 06:15:40 EST 2013","Science","BBC News","23"
"3534","German Travel Agency Organizes Trip to see Pan-STARRS Comet","Thu Mar 07 06:15:42 EST 2013","Science","French Tribune","97"
"3580","Conservation Body Rejects Polar Bear Trade Ban","Thu Mar 07 06:37:59 EST 2013","Science","ABC News","33"
"3612","Comet Pan-STARRS Invades Northern Skies","Thu Mar 07 07:07:21 EST 2013","Science","Discovery News","97"
"3625","Year of the Comets: 2013 May See Brightest Celestial Show in Years","Thu Mar 07 07:22:57 EST 2013","Science","Space.com","97"
"3686","How to spot comet Pan-STARRS this weekend","Thu Mar 07 07:33:40 EST 2013","Science","TG Daily","99"
"3711","First Evidence of a Viking-Like 'Sunstone' Found","Wed Mar 06 18:07:54 EST 2013","Science","LiveScience.com","13"
"3713","Polar bear trade ban vote defeated at meeting","Thu Mar 07 07:54:29 EST 2013","Science","BBC News","35"
"3714","Mythical Viking 'Sunstone' could have really worked: study","Thu Mar 07 07:53:14 EST 2013","Science","CTV News","14"
"3727","Scientists zero in on identifying 'God particle,' but still require more to say for sure","Thu Mar 07 07:55:06 EST 2013","Science","Fox News","24"
"3736","Researchers Measure Distance to Nearest Galaxy, Say it is 40000 Light Years ...","Thu Mar 07 08:05:26 EST 2013","Science","Nature World News","22"
"3737","Dogs may have been Man's Best Friend for long time","Thu Mar 07 08:08:05 EST 2013","Science","Houston Chronicle (blog)","16"
"3771","Camels, Icons of the Arabian Desert, Originated on Turtle Island","Thu Mar 07 08:31:05 EST 2013","Science","Indian Country Today Media Network.com","75"
"3784","Get Ready For Comet Pan-STARRS To (Briefly) Grace Our Sky","Thu Mar 07 08:00:42 EST 2013","Science","Slate Magazine (blog)","100"
"3785","Astronomers measure distance to nearest galaxy","Thu Mar 07 08:36:18 EST 2013","Science","The Space Reporter","23"
"3789","As Arctic ice melts, full steam ahead for shipping?","Mon Mar 04 18:34:46 EST 2013","Science","USA TODAY","51"
"3825","Comet Invading Northern Skies","Thu Mar 07 09:00:10 EST 2013","Science","Discovery News","101"
"3828","Carbon dioxide levels show biggest spike in 15 years","Thu Mar 07 08:45:21 EST 2013","Science","Times of India","30"
"3895","Egypt's Locust Plague Threatens Israel","Thu Mar 07 09:28:07 EST 2013","Science","NPR (blog)","19"
"3941","Birth of a new particle","Thu Mar 07 09:42:37 EST 2013","Science","The Guardian","28"
"3942","Mars rover Curiosity to sleep through solar storm","Thu Mar 07 09:46:25 EST 2013","Science","Los Angeles Times","119"
"3971","Bid to ban commercial trade in polar bears fails","Thu Mar 07 08:01:52 EST 2013","Science","Los Angeles Times","41"
"3996","Ancient giant camel lived in the Arctic","Thu Mar 07 10:10:17 EST 2013","Science","Telegraph.co.uk","77"
"4007","Ancient giant camels lived in the Arctic","Thu Mar 07 10:15:39 EST 2013","Science","Telegraph.co.uk","77"
"4008","Shipwreck Reveals Mythical Navigational Tool of the Vikings","Thu Mar 07 10:09:47 EST 2013","Science","The Maritime Executive","17"
"4013","Scientists: Vikings' 'mythical' sunstone found","Thu Mar 07 10:15:57 EST 2013","Science","USA TODAY","17"
"4143","Viking 'Sunstone' Not a Myth Anymore? Scientists Uncover Secrets Behind Old ...","Thu Mar 07 11:22:18 EST 2013","Science","Nature World News","18"
"4152","Curiosity sleeps as solar eruption barrels toward Mars","Thu Mar 07 11:22:09 EST 2013","Science","Fox News","124"
"4160","Space Tourist Dennis Tito Announces Quest for Mars by 2018 - Can He Do It?","Thu Mar 07 11:26:18 EST 2013","Science","Singularity Hub","52"
"4191","Mount Etna volcano erupts, lighting up night sky","Thu Mar 07 11:45:25 EST 2013","Science","Telegraph.co.uk","41"
"4192","Large Magellanic Cloud Measurement Suggests Nearby Galaxy Closer Than ...","Thu Mar 07 08:57:36 EST 2013","Science","Huffington Post","25"
"4199","Comet Pan-STARRS visible tonight with naked eye","Thu Mar 07 11:48:38 EST 2013","Science","Fox News","105"
"4267","'Viking sunstone' found in shipwreck","Wed Mar 06 18:46:01 EST 2013","Science","BBC News","19"
"4290","Canadian glaciers face 'big losses'","Thu Mar 07 10:13:51 EST 2013","Science","BBC News","10"
"4295","Cites: bid to curb sale of ivory and rhino horn voted down","Thu Mar 07 11:57:27 EST 2013","Science","The Guardian","49"
"4296","Polar bear trade ban rejected at global meeting","Thu Mar 07 12:22:45 EST 2013","Science","Washington Post","50"
"4326","Rare Binary Stars Provide A Better Yardstick For The Cosmos, And Could Help ...","Thu Mar 07 12:38:19 EST 2013","Science","Popular Science","26"
